{
 "nation": "USA",
 "navy": "United States Navy",
 "prefix": "us",
 "designation_system": "mark_arabic",
 "scenario": "five-term-tillman",
 "version": "platform v11 / equipment v13 / scenario 0.50 / road 1.6",
 "source": "docs/hindsight/us-five-term-tillman-equipment-catalog.md",
 "calibration": {
  "interest": [
   "the super-heavy gun line and its turrets",
   "capital-hull scale, protection and machinery",
   "the plant behind them — ways, graving docks, lock chambers, gun shops, armor mills"
  ],
  "supporting": [
   "Main-battery fire control: the rangekeeper and plot, aircraft spot correction, and the radar program the guns paid for — all of it exists to lay a battery that outranges its own eyes. ⚠ AND ITS OPTICS ARE DELIBERATELY MODEST: [us27dir] carried a 16 m turret rangefinder and an 8 m director top. NO 16 METER RANGEFINDER WAS EVER BUILT FOR ANY WARSHIP — the ceiling anywhere is Yamato's 15 m of 1941 — and both figures are now HMS Nelson's, 12.5 m in the turret roofs and 4.6 m in the directors, in Nelson's own year of 1927. The doctrine of firing beyond the horizon is the architecture claim; the glass is par.",
   "The dual-purpose director. ⚠ NOT PAR: [us34dir] is exact par with the Mark 33 of 1934, but [us36dir] is +3 on the Mark 37 of 1939, which is a supporting figure and not a par one. Its weight is 16 tons, the real Mark 37's destroyer installation, because a director with the Mark 37's optics at half the Mark 37's weight is a performance claim wearing a date."
  ],
  "par": [
   "The five-inch family. ⚠ The most closely par line in the project: the 5-inch/25 of 1925 against a real Mark 10 of 1926 (24.49 kg, 657 m/s, 13.26 km, 8,352 m ceiling); the 5-inch/38 of 1934 against a real Mark 12 of 1934 in USS Farragut (25.0 kg, 792 m/s, 16.64 km, 11,339 m); and the 5-inch/54 of 1945 against a real Mark 16 of 1945 in USS Midway — at 16.6 km where the real gun reached 23.7, so the catalog is UNDER-credited.",
   "the heavy cruiser · the destroyer · the fleet submarine",
   "light automatic anti-aircraft weapons. ⚠ The 1.1-inch quad of 1936 against a real Mark 1 of 1937 at 150 rpm on 8-round clips, and the license-built 40 mm quad of 1941 against a real US Bofors of 1942 — 160 rpm is the real gun's gravity-assisted maximum, not an invention.",
   "aero engines. ⚠ The utility engine's DISPLACEMENT is 30 L and not 22, because 575 hp from 22 L in 1929 is 26 hp/L when the R-1340 Wasp of that year made 450 hp from the same 22 liters. The horsepower did not move and no printed aircraft figure moved with it.",
   "the steam torpedo. ⚠ EXACT ON EVERY FIGURE, AND ON THE ONE THING THAT IS NOT A FIGURE: the real Mark 14 of 1931 ran 46 kt to 4,100 m and 31.5 kt to 8,200 m on a dual-mode exploder, and it was NEVER PROOF-FIRED WITH A LIVE WARHEAD — Admiral Pratt offered the hulk of USS Ericsson and forbade a live head, and the Mark 6 exploder's entire test history is two shots on 8 May 1926, the first of which failed to detonate. The electric torpedo runs 3,700 m, against a real Mark 18 that ran 29 kt to 3,650 m from September 1943.",
   "the standard-type modernization package · the five-inch shell and its proximity-ready cavity, the fuze itself arriving in 1943 against a real VT fuze that went into combat on 5 January 1943"
  ],
  "cold": [
   "naval aviation entire: airframes, carrier practice, the pilot pipeline, and the deck the pipeline runs through",
   "anti-submarine warfare: one sonar set issued as budgets allow, one depth charge, no thrower"
  ],
  "notes": "The United States bought one thing with its divergence and paid for it everywhere else, so the distribution is unusually extreme — which is the scenario. Calibers above 16 in have no historical equivalent at any date; they are plant architecture under §8's premise clause, not a performance claim, and every ballistic figure attached to them is period-honest. ⚠ Nothing above the Japanese 46 cm Type 94 was ever mounted afloat, and the American 18-inch/48 Mark 1 was NEVER COMPLETED AND NEVER FIRED — it was half-built when the Washington Treaty banned it and was relined down to 16 inches. So the ladder is architecture exactly as declared. Every generation in this file is checked against the best real-world article at any date in the window."
 },
 "lines": [
  {
   "id": "us_super_heavy_gun",
   "nation": "USA",
   "prefix": "us",
   "family": "gun",
   "name": "Super-heavy gun line",
   "band": "interest",
   "designation": "Mark 1",
   "founding_year": 1925,
   "catalog_ref": "3.1",
   "interface": "barbette_ring",
   "common": {
    "mount": "triple, individually sleeved guns",
    "elevation_deg": 45,
    "max_range_km": 40,
    "handling": "shellroom-to-gun power",
    "charges": "six-bag",
    "note": "One gun plant, retooled upward TWICE in nine years rather than rebuilt for each step. The 16 in that arms the founding rung is the 1918 pattern, sits OUTSIDE this Mark sequence and appears on the sheets that mount it as a literal spec. Every generation elevates to the same angle and is drawn to a common maximum range, so a turret crew and a plotting room move up the ladder without relearning the drill. Rate of fire falls as the bore climbs and nobody in the Bureau of Ordnance regards that as a defect. THE MOUNTING NEVER CHANGES SHAPE ON THE WAY UP: three guns to a group at every bore, because a plant that scales one architecture does not pay twice for a second."
   },
   "generations": [
    {
     "code": "us25gun",
     "year": 1925,
     "designation": "Mark 1",
     "spec": {
      "bore_in": 18,
      "bore_mm": 457,
      "length_cal": 48,
      "shell_kg": 1315,
      "shell": "armor-piercing",
      "muzzle_ms": 823,
      "rpm_per_gun": 1.5,
      "turret_t": 2500,
      "mount": "triple"
     },
     "notes": "The real 18\"/48 Mark 1 at its own decade's figures: designed 1920, to Dahlgren July 1927, converted to 16\"/56 before it ever fired as an eighteen. Exact par."
    },
    {
     "code": "us29gun",
     "year": 1929,
     "designation": "Mark 2",
     "spec": {
      "bore_in": 21.5,
      "bore_mm": 546,
      "length_cal": 45,
      "shell_kg": 2300,
      "shell": "armor-piercing",
      "muzzle_ms": 800,
      "rpm_per_gun": 1.2,
      "turret_t": 4400,
      "mount": "triple"
     },
     "notes": "The 21.5-inch. No historical equivalent at any date, so plant architecture under conventions section 8's premise clause; shell weight is the cube-law scaling of the real 18 in (1,315 kg) and the real 16 in (952 kg). The caliber came down from a proved 24-inch so the battery could go up: above 22 inches a triple's ring, hoists and flash arrangements outgrow any beam the locks will ever pass."
    }
   ]
  },
  {
   "id": "us_secondary_5in",
   "nation": "USA",
   "prefix": "us",
   "family": "sec",
   "name": "Secondary battery line",
   "band": "par",
   "designation": "Mark 1",
   "founding_year": 1925,
   "catalog_ref": "3.2",
   "interface": "secondary_base_ring",
   "common": {
    "caliber_mm": 127,
    "ammunition": "semi-fixed",
    "commonality": "shellrooms, hoists and fuze well common across all mounts",
    "note": "Rearming up the line is the one cheap refit an American hull has — everything else it might want was never provisioned for."
   },
   "generations": [
    {
     "code": "us25sec",
     "year": 1925,
     "designation": "Mark 1",
     "spec": {
      "length_cal": 25,
      "mounting": "high-angle single, open",
      "shell_kg": 24.4,
      "muzzle_ms": 657,
      "range_km": 13.3,
      "ceiling_m": 8400,
      "rpm_per_gun": 14,
      "mass_t": 20
     }
    },
    {
     "code": "us34sec",
     "year": 1934,
     "designation": "Mark 2",
     "spec": {
      "length_cal": 38,
      "mounting": "dual-purpose, single or twin base-ring",
      "shell_kg": 25,
      "muzzle_ms": 790,
      "range_km": 15.9,
      "ceiling_m": 11400,
      "rpm_per_gun": 18,
      "mass_t_single": 29,
      "mass_t_twin": 43
     }
    },
    {
     "code": "us45sec",
     "year": 1945,
     "designation": "Mark 3",
     "spec": {
      "length_cal": 54,
      "mounting": "dual-purpose single, enclosed base-ring",
      "shell_kg": 31.8,
      "muzzle_ms": 808,
      "range_km": 16.6,
      "ceiling_m": 13700,
      "rpm_per_gun": 16,
      "mass_t": 45
     }
    }
   ]
  },
  {
   "id": "us_quad_aa_cannon",
   "nation": "USA",
   "prefix": "us",
   "family": "can",
   "name": "Quad anti-aircraft cannon",
   "band": "par",
   "designation": "Mark 1",
   "founding_year": 1936,
   "catalog_ref": "3.3",
   "interface": "cannon_position",
   "common": {
    "mount": "quad",
    "cooling": "water-cooled barrels",
    "feed": "clip-fed by hand",
    "natures": 1,
    "projectile": "high-explosive tracer",
    "note": "Its endurance in action is a property of its loaders rather than of a magazine. It arrived as a fitting rather than as a provision, which is why every ship that carries it paid structural prices for it."
   },
   "generations": [
    {
     "code": "us36can",
     "year": 1936,
     "designation": "Mark 1",
     "spec": {
      "round": "28 x 199 mm",
      "shell_kg": 0.42,
      "rpm_per_barrel": 150,
      "clip": 8,
      "mount_t": 6.4
     }
    },
    {
     "code": "us41can",
     "year": 1941,
     "designation": "Mark 2",
     "spec": {
      "round": "40 x 311 mm, license-built",
      "shell_kg": 0.9,
      "rpm_per_barrel": 160,
      "clip": 4,
      "train": "power-trained, director-capable",
      "mount_t": 11
     }
    }
   ]
  },
  {
   "id": "us_quad_torpedo_mount",
   "nation": "USA",
   "prefix": "us",
   "family": "lau",
   "name": "Quad torpedo mount",
   "band": "par",
   "designation": "Mark 1",
   "founding_year": 1934,
   "catalog_ref": "3.4",
   "interface": "torpedo_mount_seat",
   "common": {